uniqueReference,sdesc,fdesc
medieval_latin_amice,a white linen amice,"This white linen amice is a rectangular cloth sized to sit around the neck and shoulders beneath other vestments. Its edges are neatly folded, and small ties are worked into the corners to keep the cloth close. The linen is plain, pale, and smooth, serving as a clean visible layer at the collar."
medieval_latin_linen_cincture,a white linen cincture,"This white linen cincture is a narrow corded sash for drawing in a loose robe at the waist. It is braided from pale linen with a simple hand and modest hanging ends. The surface is clean and undecorated, giving it the appearance of an ordered working tie rather than a rich belt."
medieval_latin_stole,a $colour silk stole,"This $colour silk stole is a long, narrow band of cloth with neatly weighted ends and a smooth lustre. The silk catches light along its length, making the $colour tone appear richer where the fabric bends. Its construction is formal and restrained, with straight edges and a clearly ceremonial fall."
medieval_latin_maniple,a $colour silk maniple,"This $colour silk maniple is a short band of fine cloth made to hang from the forearm. The silk is light and smooth, with the $colour shade most visible across the folded central panel. Its ends are carefully squared, giving the small vestment a deliberate and formal outline."
medieval_latin_chasuble,a fine $colour silk chasuble,"This fine $colour silk chasuble is cut as a broad outer vestment with a head opening and a sweeping fall over the torso. The silk lies in rounded folds, its $colour surface broken by the shadow of the shoulders and the heavy lower edge. It is visibly more formal than ordinary clothing, relying on rich cloth, breadth, and clean ceremonial shape."
medieval_latin_dalmatic_vestment,a fine $colour silk dalmatic,"This fine $colour silk dalmatic is a loose, straight vestment with broad sleeves and a squared body. The $colour silk hangs smoothly from the shoulders, leaving the sleeve openings wide and visible. Its formal cut gives it a robe-like dignity while keeping the shape distinct from a closed cloak or mantle."
medieval_latin_processional_cope,a fine $colour silk cope,"This fine $colour silk cope is a great open cloak with a broad semicircular sweep and a smooth outer face. The silk gathers at the shoulders before spreading into a full ceremonial fall, showing the $colour most clearly across the back. Its edge is carefully finished, making the whole garment read as formal outerwear rather than a travelling cloak."
medieval_latin_bishop_mitre,a fine white silk mitre,"This fine white silk mitre is a tall folded headpiece with two stiffened peaks rising above the brow. The silk is pale and smooth, with carefully joined seams holding the upright form. Narrow hanging bands fall from the back, making the headwear unmistakably formal without adding other carried objects."
medieval_latin_bishop_gloves,a pair of fine white liturgical gloves,"These fine white liturgical gloves are sewn from smooth silk with close fingers and neat wrist openings. The fabric has a pale sheen and lies cleanly against the hand when worn. Their finish is more delicate than working gloves, with the emphasis on spotless cloth and careful seams."
medieval_latin_archbishop_pallium,a white wool pallium band,"This white wool pallium band is a narrow looped vestment with hanging ends that fall over the chest and back. The wool is fine, pale, and tightly woven, giving the small garment a clean ceremonial presence. Dark cross-like markings are worked into the band as visible decoration rather than separate metal fittings."
medieval_eastern_black_riassa,a black wool riassa,"This black wool riassa is a long outer robe with a loose body and broad, unhurried sleeves. The cloth is sober and dark, falling from the shoulders in a straight vertical line. Its construction is plain but ample, giving the wearer a formal clerical outline without bright trimming."
medieval_eastern_monastic_mantle,a black wool monastic mantle,"This black wool monastic mantle is a wide outer wrap with enough breadth to cover the shoulders and much of the body. Its folds are heavy and dark, giving the garment a solemn, enclosing silhouette. The edges are simple and unembroidered, with visual weight supplied by the cloth itself."
medieval_eastern_black_klobuk,a black veiled klobuk,"This black veiled klobuk combines a firm dark cap with a hanging veil that falls around the back and sides. The wool is matte and close, with the veil softening the hard line of the cap. It frames the head in a severe, recognisable shape without relying on jewels or bright colour."
medieval_eastern_womens_monastic_veil,a black monastic veil,"This black monastic veil is a plain wool head covering made to fall over the hair, shoulders, and upper back. The fabric is soft enough to fold close to the face but heavy enough to keep a dark, settled outline. It is modest and undecorated, with only the clean fall of cloth marking its form."
medieval_eastern_sticharion,a white linen sticharion,"This white linen sticharion is a long, straight liturgical robe with close sleeves and a pale, even surface. The linen falls cleanly to the feet, forming a bright underlayer beneath richer vestments. Its seams are tidy and restrained, emphasizing length and whiteness rather than decoration."
medieval_eastern_orarion,a $colour silk orarion,"This $colour silk orarion is a long narrow vestment meant to lie over the shoulder in a clear vertical line. The silk is smooth and formal, making the $colour surface catch light along its length. Its edges are straight and carefully finished, giving the band a precise liturgical appearance."
medieval_eastern_epitrachelion,a $colour silk epitrachelion,"This $colour silk epitrachelion is a paired stole joined at the neck and falling in two long panels down the front. The $colour silk has a formal sheen, broken by the fold where the fabric sits around the collar. Its length, symmetry, and careful edging make it distinct from an ordinary scarf."
medieval_eastern_epimanikia,a pair of $colour silk epimanikia,"These $colour silk epimanikia are fitted cuffs made to wrap around the lower sleeves. The silk panels are small but carefully shaped, with ties or narrow bands visible at the inner wrist. Their $colour surface gives a bright, formal finish to the hands and forearms."
medieval_eastern_phelonion,a fine $colour silk phelonion,"This fine $colour silk phelonion is a wide sleeveless outer vestment with a rounded fall from the shoulders. The front is cut to clear the hands while the back drops in a fuller sweep, showing the $colour silk in deep folds. Its form resembles a ceremonial mantle, but the head opening and continuous body give it a distinctive liturgical shape."
medieval_eastern_sakkos,a fine $colour silk sakkos,"This fine $colour silk sakkos is a square-cut outer vestment with broad sleeves and a structured, tunic-like body. The sides are visibly joined by small fastenings or ties, leaving the garment formal but not closely fitted. Its $colour silk and deliberate shape make it more imposing than an ordinary robe."
medieval_eastern_omophorion,a fine white silk omophorion,"This fine white silk omophorion is a broad band made to lie over the shoulders and fall across the chest. The silk is pale, smooth, and substantial enough to hold its line over heavier vestments. Dark cross-like markings break the white field, giving the band an episcopal and ceremonial appearance."
medieval_eastern_kamilavkion,a black felt kamilavkion,"This black felt kamilavkion is a stiff cylindrical cap with a flat crown and straight sides. The felt is dense and matte, holding the cap in a crisp, upright shape. Its severe black surface and clean silhouette give it a formal clerical character."
medieval_islamic_plain_imam_qamis,a plain white cotton imam qamis,"This plain white cotton qamis is a long, straight robe with modest sleeves and a clean front. The cotton is light but opaque, falling in simple folds suited to warm interiors and layered dress. Its whiteness and spare construction make it visibly clean without making it ornate."
medieval_islamic_plain_imam_turban,a plain white cotton imam turban,"This plain white cotton imam turban is made from a long length of cloth wrapped into a neat, layered head covering. The cotton is clean and soft, with overlapping folds forming a modest rounded shape. No jewel or badge marks it, leaving its presence in the whiteness and regularity of the wrap."
medieval_islamic_scholars_jubba,a dark wool scholar's jubba,"This dark wool scholar's jubba is a long outer robe with full sleeves and a dignified, loose body. The wool is smoother than common work cloth, giving the dark surface a measured formal weight. It is cut for layering over a qamis and sirwal, with plain hems and a calm, authoritative silhouette."
medieval_islamic_taylasan,a dark wool taylasan hood,"This dark wool taylasan is a hooded head covering with a short shoulder fall and a sober drape. The wool is fine enough for learned or official wear, but its colour remains restrained. Its shape frames the head and upper shoulders without becoming a full cloak."
medieval_islamic_qadi_turban,a fine white scholar's turban,"This fine white scholar's turban is wrapped from a long, clean length of cotton into a careful formal shape. The folds are regular and layered, giving the headwear more presence than a simple working wrap. Its colour is plain, but the neatness of the cotton and the size of the winding give it dignity."
medieval_sufi_patched_khirqa,a patched wool khirqa,"This patched wool khirqa is a loose robe assembled from visibly different pieces of worn cloth. The patches vary in tone and texture, but the whole garment keeps a roughly ordered robe shape with long sleeves and a full body. It looks intentionally poor and mended, using its roughness as its most visible feature."
medieval_sufi_wool_sash,a coarse wool Sufi sash,"This coarse wool Sufi sash is a plain length of cloth meant to bind a robe at the waist. The wool is rough, dark, and slightly uneven, with frayed-looking ends left visible. It is more severe than decorative, adding a practical horizontal line to otherwise loose clothing."
medieval_sufi_felt_cap,a plain felt dervish cap,"This plain felt dervish cap is a simple, close head covering shaped from dense felt. Its sides are unadorned, and the crown is rounded without embroidery or metal fittings. The material gives it a soft but durable outline suited to rough travel or simple lodgings."
medieval_sufi_coarse_wool_cloak,a coarse wool Sufi cloak,"This coarse wool Sufi cloak is a heavy open wrap with a rough, plainly woven surface. It falls from the shoulders in uneven dark folds, large enough to cover a patched robe or plain qamis beneath. The cloak is austere rather than elegant, with a practical weight and little concern for polish."
medieval_jewish_tallit_gadol,a white wool tallit gadol,"This white wool tallit gadol is a broad rectangular prayer shawl with dark narrow stripes near the ends. The wool is light enough to drape over the shoulders but large enough to cover much of the upper body. Long fringes hang from the corners, making the garment visibly distinct from an ordinary mantle."
medieval_jewish_tallit_katan,a white wool tallit katan,"This white wool tallit katan is a small four-cornered undergarment with a simple head opening and straight hanging panels. The wool is plain and pale, meant to sit beneath or between ordinary clothing layers. Fringes at the corners mark it clearly even though the body of the garment is spare."
medieval_jewish_skullcap,a plain wool skullcap,"This plain wool skullcap is a small close-fitting cap made to sit neatly on the crown of the head. The wool is dark, soft, and unornamented, with shallow seams shaping the rounded form. It is modest and compact, giving little visual weight beyond its careful fit."
medieval_jewish_scholars_robe,a dark wool scholar's robe,"This dark wool scholar's robe is a long, dignified garment with full sleeves and a restrained front. The wool is smooth enough to suggest careful making, while the dark colour keeps it sober. It is shaped for town and synagogue use, with neat hems and an uncluttered fall over inner layers."
medieval_hindu_white_priest_dhoti,a white cotton priest's dhoti,"This white cotton priest's dhoti is a long lower cloth folded and wrapped into a clean, ankle-length drape. The cotton is light, plain, and kept pale, with the broad folds showing the garment's rectangular origin. Its simplicity and whiteness make it visibly more ritual-clean than a colourful everyday lower cloth."
medieval_hindu_white_uttariya,a white cotton uttariya,"This white cotton uttariya is a rectangular shoulder cloth made to pass over the upper body in a simple drape. The cotton is thin, clean, and unpatterned, showing soft folds where it crosses the shoulder. It is modest and light, meant to sit over bare skin or a simple underlayer without ornament."
medieval_hindu_kaupina,a plain cotton kaupina,"This plain cotton kaupina is a very simple loincloth made from a narrow length of white cloth. It is cut and folded for minimal coverage, with no decoration beyond the clean edges of the fabric. The cotton is light and practical, giving the garment an intentionally austere appearance."
medieval_hindu_ochre_ascetic_wrap,an ochre cotton ascetic wrap,"This ochre cotton ascetic wrap is a long rectangular cloth arranged to cover the body in loose folds. The cotton has a warm earth-coloured tone and a plain, unshaped surface. Its form is intentionally simple, relying on wrapping and tucking rather than tailoring."
medieval_hindu_ochre_shoulder_cloth,an ochre cotton shoulder cloth,"This ochre cotton shoulder cloth is a narrow rectangular drape for the upper body. The fabric is light and plain, with its warm colour showing most clearly along the broad hanging panels. It can fall over one shoulder or both, giving a simple ascetic layer above a lower wrap."
medieval_jain_white_ascetic_robe,a white cotton ascetic robe,"This white cotton ascetic robe is a plain, lightly wrapped garment with a straight and modest fall. The cotton is pale, unadorned, and deliberately simple, showing only folds and hems. Its appearance is white-clad and austere, avoiding rich dye, trim, or display."
medieval_jain_white_shoulder_wrap,a white cotton shoulder wrap,"This white cotton shoulder wrap is a plain rectangular cloth made to cover the upper body in a modest drape. The cotton is light and uncoloured, with neat edges and no visible decoration. It sits quietly over a robe or lower cloth, reinforcing a spare white-clad appearance."
medieval_buddhist_plain_underrobe,a plain hemp monastic underrobe,"This plain hemp monastic underrobe is a straight, cross-wrapped robe with close sleeves and a practical hem. The hemp is sturdy, dull, and lightly textured, giving the garment a subdued working surface. It is meant to sit beneath a kasaya or mantle, with no decoration competing with the outer cloth."
medieval_buddhist_patched_kasaya,a patched cotton kasaya,"This patched cotton kasaya is a rectangular mantle built from many sewn panels. The cotton pieces are arranged in a deliberate grid, with seams forming a visible patchwork field across the cloth. It drapes over the shoulder and upper body, looking formal through pattern and construction rather than luxury."
medieval_buddhist_nun_robe,a dark hemp nun robe,"This dark hemp nun robe is a plain wrapped garment with long sleeves and a full, modest body. The hemp is firm and matte, with a darkened surface that hides wear better than pale cloth. Its lines are simple and practical, leaving the robe suited to layered monastic dress."
medieval_buddhist_formal_kesa,a fine silk kesa mantle,"This fine silk kesa mantle is a rectangular patchwork garment made from smooth, carefully joined panels. The silk has a muted ceremonial sheen, and the panel layout gives the cloth a measured, gridded order. It is worn as an outer mantle, more formal than a common kasaya but still defined by patchwork construction."
medieval_buddhist_travelling_mantle,a dark wool monastic travelling mantle,"This dark wool monastic travelling mantle is a broad outer cloth for sheltering a robe on the road. The wool is plain and serviceable, falling in wide folds over the shoulders and down the back. Its shape is practical and unornamented, closer to a traveller’s wrap than a formal temple mantle."
medieval_buddhist_black_monastic_robe,a black hemp monastic robe,"This black hemp monastic robe is a straight wrapped garment with close sleeves and a plain collar line. The hemp has a dry, matte surface, darkened into a sober black without decorative contrast. Its cut is practical and restrained, keeping the focus on length, folds, and simplicity."
medieval_daoist_cross_collar_robe,a dark cotton Daoist robe,"This dark cotton Daoist robe is cut with a cross-collar front, long sleeves, and a straight body. The cotton is plain and smooth, allowing the overlapping collar and tied closure to define the garment. It looks formal but not lavish, suited to a religious specialist rather than court display."
medieval_daoist_cloud_sleeved_robe,a fine $colour cloud-sleeved robe,"This fine $colour cloud-sleeved robe is a silk ritual garment with broad sleeves and a loose cross-collar body. The sleeves spread widely from the arm, making the $colour silk fall in soft ceremonial folds. Its shape is more expansive than an ordinary robe, giving the garment a deliberate temple-formal presence."
medieval_daoist_ritual_cap,a black cloth ritual cap,"This black cloth ritual cap is a compact headpiece made from stiffened cotton panels. The shape is neat and angular, with a dark surface that sits close to the head. It is modest in scale but clearly formal, adding a precise finish to a robe without bright decoration."
medieval_shinto_white_joe_robe,a white hemp jōe robe,"This white hemp jōe robe is a pale ceremonial garment with a straight body and broad, courtly sleeves. The hemp is clean and carefully finished, giving the robe a crisp surface despite its simple colour. Its shape recalls formal court dress, but the lack of pattern keeps it restrained and shrine-focused."
medieval_shinto_priest_hakama,a pair of white shrine hakama,"These white shrine hakama are broad pleated trousers with a full, skirt-like fall. The hemp cloth is pale and crisp, holding the pleats in clean vertical lines. Their breadth and colour make them visibly ceremonial rather than ordinary work hakama."
medieval_shinto_priest_eboshi,a black lacquered eboshi,"This black lacquered eboshi is a tall, folded headpiece with a crisp upright silhouette. The silk body is stiffened and darkened to a smooth black surface, keeping its shape above the brow. It looks formal and courtly, pairing with shrine robes without needing additional ornament."
medieval_shinto_miko_white_kosode,a white hemp shrine kosode,"This white hemp shrine kosode is a short-sleeved robe with a straight wrapped front and narrow body. The hemp is pale, clean, and simply finished, showing little beyond the collar line and sleeve openings. It forms a modest upper layer for shrine service rather than a fashionable court garment."
medieval_shinto_miko_red_hakama,a pair of red shrine hakama,"These red shrine hakama are broad pleated trousers made to fall in long, straight folds. The hemp cloth is dyed a clear red, making the lower garment stand out sharply beneath a white kosode. Their pleats and fullness give them a formal shrine-service outline while remaining practical to move in."
medieval_steppe_ritual_felt_coat,a felt-lined ritual coat,"This felt-lined ritual coat is a long front-opening garment with loose sleeves and a practical steppe cut. Dense felt gives it body and warmth, while the outer surface remains plain enough to resemble travelling clothing. Its ritual character comes from its deliberate use as a special outer layer rather than from metal fittings or carried objects."
medieval_steppe_ritual_fur_cap,a fur-trimmed ritual cap,"This fur-trimmed ritual cap is a warm headpiece with a soft crown and a thick band around the brow. The fur gives the cap a rough, animal-textured edge, contrasting with the simpler cloth or felt of the crown. It is visually suited to cold open country and to a specialist set apart by distinctive winter headwear."
medieval_steppe_ritual_sash,a braided wool ritual sash,"This braided wool ritual sash is a sturdy belt-like length of woven cloth with a visibly twisted structure. Its surface is rough and practical, with ends that hang plainly once tied. It adds a marked band across a robe or coat without claiming pockets, tools, or other unsupported functions."
medieval_annular_bronze_brooch,a bronze annular brooch,"This bronze annular brooch is shaped as a plain circular ring with a slim pin crossing the opening. The surface is modestly polished, with most of its detail in the clean curve and the slight flattening around the pin hinge. It is sized to sit visibly at a shoulder or chest over a cloak, mantle, or heavy outer layer."
medieval_penannular_bronze_brooch,a bronze penannular brooch,"This bronze penannular brooch forms an open ring with two slightly thickened terminals and a long movable pin. Fine filing marks show around the ends, while the broader front catches light when worn over wool. Its shape gives a clear cloak-fastening appearance without relying on any hidden mechanism."
medieval_pair_oval_brooches,a pair of bronze oval brooches,"These bronze oval brooches are made as a matched pair, each with a domed face and a narrow back pin. The surfaces carry shallow raised lines that break up the polished metal without making them overly ornate. They are visually suited to being worn symmetrically over a strap dress or front-hanging garment layer."
medieval_plain_bronze_cloak_pin,a plain bronze cloak pin,"This plain bronze cloak pin is a straight, practical fastening piece with a narrow shaft and slightly broader head. Its metal has a muted brown-gold sheen, with no decoration beyond the worked tip and smoothed edges. It reads as a humble outerwear fitting rather than a jewel or badge."
medieval_iron_cloak_pin,an iron cloak pin,"This iron cloak pin is dark, narrow, and plainly forged, with a simple head and a tapering point. The metal is sturdy rather than elegant, showing faint hammering and a workmanlike finish. It suits rough wool, patched cloaks, and road clothing where visible utility matters more than display."
medieval_bronze_mounted_leather_belt,a leather belt with bronze mounts,"This leather belt is fitted with small bronze mounts set at intervals along the strap. The leather is broad enough to show its grain, while the metal pieces give it a stronger and more prosperous look. It is decorative waistwear and does not imply pockets, hooks, or storage beyond its visible belt form."
medieval_silver_mounted_leather_belt,a fine silver-mounted belt,"This fine leather belt is set with small silver mounts and a neatly finished buckle. The strap is smooth and carefully edged, with the pale metal standing out against the darker leather. It presents wealth and care in dress without suggesting any hidden attachments or carried goods."
medieval_tablet_woven_garters,a pair of $colour tablet-woven garters,"These $colour tablet-woven garters are narrow wool bands with a firm, patterned structure. Each strip is long enough to wrap neatly around the leg, with cleanly finished ends that can lie flat against hose or chausses. The $colour tone shows best across the raised weave and makes them more refined than plain work ties."
medieval_wool_leg_ties,a pair of $colour wool leg ties,"These $colour wool leg ties are simple narrow lengths of woven cloth, made for binding loose lower-leg layers into a tidy line. The weave is plain and slightly springy, with ends that show minor fraying from use. Their $colour appearance is practical and understated, suited to common travel or labour clothing."
medieval_linen_headband,a $colour linen headband,"This $colour linen headband is a narrow strip of folded cloth with lightly hemmed edges. It is simple enough for work wear, keeping its shape through neat creases rather than stiffness. The $colour dye is plain and even across the band."
medieval_silk_hair_ribbon,a fine $colour silk hair ribbon,"This fine $colour silk hair ribbon is a narrow, smooth strip with a soft sheen and delicate folded edges. It is light enough to trail from tied hair or a small head arrangement without adding bulk. The $colour surface gives it a refined decorative quality suited to elite or formal dress."
medieval_silk_robe_sash,a fine $colour silk robe sash,"This fine $colour silk robe sash is long, smooth, and lightly weighted so it can lie in clean folds at the waist. The edges are carefully turned, and the fabric has enough sheen to mark it as a dressier layer. Its $colour surface is meant for visible contrast over robes, caftans, or formal gowns."
medieval_woven_kosode_sash,a $colour woven kosode sash,"This $colour woven kosode sash is a narrow, straight length of fabric with a firm hand and flat selvages. It is simpler and less formal than later elaborate waist sashes, with its effect coming from tidy wrapping rather than ornament. The $colour dye gives a clear band of contrast against a robe."
medieval_hemp_waist_cord,a plaited hemp waist cord,"This plaited hemp waist cord is made from coarse fibres twisted into a narrow, durable line. The surface is dry and slightly rough, with simple knotted ends and no metal fittings. It is a humble waist binding and carries no implication of attachments, storage, or rank."
